{
  "$schema": "../../../../../.planning/workflow/schemas/handoff-1-to-2.schema.json",
  "schemaVersion": "1.0.0",
  "plugin": "O-Contrabass",
  "timestamp": "2026-04-26T12:00:00Z",
  "summary": "Buildable JUCE 8 synth shell with all 29 APVTS parameters, output-only bus, scala-tuning-engine + note-expression modules wired, AU validated (auval) and VST3 pluginval strictness 10 SUCCESS on macOS.",
  "stateSnapshot": {
    "stage": "1-foundation",
    "phase": "complete",
    "parameterCount": 29,
    "buildVerified": true,
    "source": [
      "SUMMARY.md",
      "VERIFICATION.md"
    ]
  },
  "artifacts": {
    "required": [
      { "path": "CMakeLists.txt", "exists": true, "type": "config", "note": "juce_add_plugin synth config (IS_SYNTH TRUE, NEEDS_MIDI_INPUT TRUE), output-only bus, NEEDS_WEBVIEW2 TRUE + JUCE_USE_WIN_WEBVIEW2_WITH_STATIC_LINKING=1, scala-tuning-engine (Pattern B) + note-expression (Pattern A) modules wired" },
      { "path": "Source/PluginProcessor.h", "exists": true, "type": "header", "note": "OContrabassAudioProcessor declaration; public APVTS; no getLatencySamples override (comment-only at line 49)" },
      { "path": "Source/PluginProcessor.cpp", "exists": true, "type": "implementation", "note": "All 29 APVTS params with UPPER_SNAKE_CASE IDs verbatim from parameter-spec.md, output-only BusesProperties, setLatencySamples(0) in prepareToPlay, silent processBlock under ScopedNoDenormals, APVTS XML state save/restore, createPluginFilter() entry point" },
      { "path": "Source/PluginEditor.h", "exists": true, "type": "header", "note": "Stub editor declaration" },
      { "path": "Source/PluginEditor.cpp", "exists": true, "type": "implementation", "note": "600x400 black canvas with Stage 1 placeholder label" }
    ],
    "optional": [
      { "path": ".planning/stages/1-foundation/SUMMARY.md", "exists": true, "type": "doc", "note": "Stage 1 execute summary" },
      { "path": ".planning/stages/1-foundation/VERIFICATION.md", "exists": true, "type": "doc", "note": "Goal-backward verification verdict: VERIFIED" }
    ],
    "validation": {
      "allRequiredPresent": true,
      "checkedAt": "2026-04-26T12:00:00Z"
    }
  },
  "decisions": [
    {
      "id": "FND-001",
      "decision": "Output-only BusesProperties (no input bus) to enforce strict synth contract",
      "rationale": "IS_SYNTH TRUE plugins must not declare input buses; pluginval strictness 10 + auval both verify this; matches Ouaricon synth-plugin pattern",
      "date": "2026-04-26",
      "alternatives": ["Default BusesProperties with input (would fail strict synth contract)"],
      "supersedes": null
    },
    {
      "id": "FND-002",
      "decision": "setLatencySamples(0) in prepareToPlay; do NOT override getLatencySamples()",
      "rationale": "AudioProcessor::getLatencySamples() is non-virtual in JUCE 8 (CLAUDE.md memory); attempting to override compiles silently but never fires. Stage 2 will update the value at prepareToPlay once oversampling latency is known.",
      "date": "2026-04-26",
      "alternatives": ["Override getLatencySamples() (broken in JUCE 8 — silent no-op)"],
      "supersedes": null
    },
    {
      "id": "FND-003",
      "decision": "Wire scala-tuning-engine via Pattern B (target_sources) and note-expression via Pattern A (ouaricon_add_module) at Stage 1",
      "rationale": "Locks the build-system surface area now so Stage 2 (Phase 2.6) can call the modules without revisiting CMake. note-expression module patches the JUCE VST3 client; deferring its inclusion to Stage 2 risks a mid-stage CMake regeneration.",
      "date": "2026-04-26",
      "alternatives": ["Defer module wiring to Stage 2 (forces mid-stage CMake refactor)"],
      "supersedes": null
    },
    {
      "id": "FND-004",
      "decision": "Both NEEDS_WEBVIEW2 TRUE and JUCE_USE_WIN_WEBVIEW2_WITH_STATIC_LINKING=1 set at Stage 1",
      "rationale": "Avoids the WebView silent-blank-page bug on Windows (CLAUDE.md memory: dynamic loader looks for WebView2Loader.dll which is not distributed). Stage 3 GUI will use WebView; baking the flags in early prevents a Stage 3 build-system regression.",
      "date": "2026-04-26",
      "alternatives": ["Add flags later at Stage 3 (risks shipping a blank-page WebView build)"],
      "supersedes": null
    }
  ],
  "contextForNextStage": {
    "receivingStage": "2-dsp",
    "keyInformation": [
      "29 APVTS parameters fully registered: BOW_PRESSURE, BOW_SPEED, BOW_POSITION, BOW_NOISE, ROSIN, BODY_SIZE, BODY_RESONANCE, BRIGHTNESS, STRING_STIFFNESS, STRING_TENSION, STRING_DAMPING, DETUNE_E, DETUNE_A, DETUNE_D, DETUNE_G, EXPRESSION_MACRO, VIBRATO_RATE, VIBRATO_DEPTH, VIBRATO_DELAY, INFINITE_SUSTAIN, SUB_HARMONICS, SLOW_BOW_RATE, SLOW_BOW_DEPTH, OUTPUT_GAIN, MASTER_SAT, LIMITER_CEILING, TUNING_SYSTEM, REFERENCE_PITCH, MTS_ESP_ENABLE",
      "AU 4-char triplet: aumu OCbs OuDv (instrument / OCbs / Ouaricon Audio Development)",
      "Build verified macOS: ninja O-Contrabass_VST3 O-Contrabass_AU O-Contrabass_Standalone",
      "auval -v aumu OCbs OuDv: SUCCEEDED (render at 11025/22050/44100/48000/96000/192000 Hz, MIDI, parameter scheduling all PASS)",
      "pluginval --strictness-level 10 --validate-in-process: SUCCESS (44.1/48/96 kHz x 64-1024 frame matrix, fuzz parameters, state restore, parameter thread safety all PASS)",
      "Output bus confirmed: 0 input ch / 2 output ch",
      "scala-tuning-engine sources at CMakeLists.txt:30-33; note-expression via ouaricon_add_module() at CMakeLists.txt:80",
      "Phase 2.1 cycle scope only: highest-risk path validation (E1 friction junction at max INFINITE_SUSTAIN); Phases 2.2-2.6 each get fresh GSD cycles after 2.1 verifies",
      "PLAN.md (Stage 2) locks two research-driven deviations: (1) WaveguideString is bass-adapted reimplementation, NOT verbatim port from O-Bowed; (2) SchellengGuard NOT extracted in 2.1b (deferred to Phase 2.3 v1.1.0 follow-up)"
    ],
    "continueCommand": "/plugin-execute O-Contrabass 2-dsp",
    "alternativeCommands": [
      "/plugin-status O-Contrabass",
      "/plugin-discuss O-Contrabass 2-dsp"
    ]
  }
}
